{
  "schema_version": "estimate/v2",
  "target": { "metric": "cost_usd", "unit": "usd" },
  "decision": {
    "status": "abstained",
    "reason_codes": ["INSUFFICIENT_POPULATION", "DISTANCE_ABOVE_THRESHOLD"]
  },
  "applicability": {
    "status": "out_of_domain",
    "nearest_distance": 5.2,
    "distance_threshold": 2.0
  },
  "cohort": {
    "agent_type": "claude-code",
    "model_provider": "anthropic",
    "model_generation": "claude-5",
    "model_id": "claude-sonnet-5",
    "routing_policy_digest": "aaaaaaaaaaaaaaaaaaaaaaaaaaaaaaaaaaaaaaaaaaaaaaaaaaaaaaaaaaaaaaaa",
    "prompt_policy_digest": "bbbbbbbbbbbbbbbbbbbbbbbbbbbbbbbbbbbbbbbbbbbbbbbbbbbbbbbbbbbbbbbb",
    "measure_contract_version": "agent-metrics/v1",
    "token_basis": "native",
    "execution_profile_digest": "cccccccccccccccccccccccccccccccccccccccccccccccccccccccccccccccc"
  },
  "population": {
    "candidate_count": 3,
    "eligible_count": 1,
    "excluded_by_reason": { "DISTANCE_ABOVE_THRESHOLD": 2 }
  },
  "prediction_interval": { "status": "insufficient_data" },
  "coverage_history": { "frozen_predictions_only": true },
  "drift": { "status": "stable" }
}
