{
  "schema_version": "estimate/v2",
  "target": { "metric": "cost_usd", "unit": "usd" },
  "decision": { "status": "abstained", "reason_codes": ["NOVEL_SURFACE_UNKNOWN"] },
  "applicability": { "status": "unknown" },
  "cohort": {
    "agent_type": "claude-code",
    "model_provider": "anthropic",
    "model_generation": "claude-5",
    "model_id": "claude-sonnet-5",
    "routing_policy_digest": "aaaaaaaaaaaaaaaaaaaaaaaaaaaaaaaaaaaaaaaaaaaaaaaaaaaaaaaaaaaaaaaa",
    "prompt_policy_digest": "bbbbbbbbbbbbbbbbbbbbbbbbbbbbbbbbbbbbbbbbbbbbbbbbbbbbbbbbbbbbbbbb",
    "measure_contract_version": "agent-metrics/v1",
    "token_basis": "native",
    "execution_profile_digest": "cccccccccccccccccccccccccccccccccccccccccccccccccccccccccccccccc"
  },
  "population": { "candidate_count": 0, "eligible_count": 0, "excluded_by_reason": {} },
  "prediction_interval": { "status": "insufficient_data" },
  "coverage_history": { "frozen_predictions_only": true },
  "drift": { "status": "insufficient_data" }
}
