{
  "schema_version": "estimate/v2",
  "target": { "metric": "cost_usd", "unit": "usd" },
  "decision": { "status": "predicted", "reason_codes": ["DRIFT_WARNING"] },
  "predicted": { "p50": 1.2, "p80": 2.4, "value_status": "estimated" },
  "applicability": { "status": "in_domain", "nearest_distance": 0.3, "distance_threshold": 2.0 },
  "cohort": {
    "agent_type": "claude-code",
    "model_provider": "anthropic",
    "model_generation": "claude-5",
    "model_id": "claude-sonnet-5",
    "routing_policy_digest": "aaaaaaaaaaaaaaaaaaaaaaaaaaaaaaaaaaaaaaaaaaaaaaaaaaaaaaaaaaaaaaaa",
    "prompt_policy_digest": "bbbbbbbbbbbbbbbbbbbbbbbbbbbbbbbbbbbbbbbbbbbbbbbbbbbbbbbbbbbbbbbb",
    "measure_contract_version": "agent-metrics/v1",
    "token_basis": "native",
    "execution_profile_digest": "cccccccccccccccccccccccccccccccccccccccccccccccccccccccccccccccc"
  },
  "population": {
    "candidate_count": 42,
    "eligible_count": 38,
    "excluded_by_reason": { "DISTANCE_ABOVE_THRESHOLD": 4 }
  },
  "prediction_interval": { "status": "insufficient_data" },
  "coverage_history": { "frozen_predictions_only": true },
  "drift": { "status": "warning" }
}
